Name,Artist,Topic,Lyrics
Blacklist,Dame Dolla,Racism,"As a brotha with a good heart, I say ""Fuck you,"" if you racist Or whites stayin' quiet, you disablin' the changes And fuck bein' famous, tired of watchin' us complainin' Cops kill a brother, get released after arraignments We in a pandemic, thought gettin' out, I'd be more joyed Then I watched a cop, knee to the neck and kill George Floyd They hide behind the badge, we get to postin', it never last Like was we ever mad? Speed up the process and do the dash, uh Showin' up at every establishment, breakin' glass Takin' all they high-end products and makin' cash We in our bag, they gettin' mad, gotta attack the D.O.L.L.A Break they ass off proper, hit, dogs holler As a rich black man livin' in this country, it's hard bein' comfy When the hate your people get is comin' from the ones amongst me Used to call us monkeys and slaves and we overcame Still, our work is just beginnin', protests look like parades And if a teammate of mine do underage I'ma snitch, man, you ain't a fit I ain't gon' sit or convince myself that I'm bein' loyal or mad at you So why these good cops won't speak on the bad apples? How the President get on the TV and be mad casual, like ""If you lootin', we shootin',"" like it's a game? Dude a clown and a trust fund baby, he numb to pain Never had it hard, came into office, unpatched the scars Let the racist folks tell us we really ain't make it far I feel the tension risin', 1950, how we divided And I ain't even trippin' on how the season decided Racism pandemic is years ahead of the virus Really mean it, but they gon' try to play us as tyrants, look Ali wasn't the greatest just 'cause his hands work Front line for his people, this was a man's work Before he let the black people down, he let the fans hurt So if the stars is aligned, that mean it can work Don't need approval, I've always been doin' God's work Even before I was in a Bentley like Farnsworth Make me sick to my stomach to see these moms hurt Tommy Smith, fists in the air, that's what our bond worth Support black businesses, gotta fight evil We love ourselves, we don't hate white people We just strivin' for equality, acknowledge me Don't just kill me for chillin' when in my property Got some shit on my mind and I'm feelin' helpless 'Cause we need help from people who ain't dealt with The kinda shit we experience, how we felt When the country turned on Kaepernick after he knelt-ed All the shit we endured and we still playin' fair That black skin really thicker than some Jamaican hair Our culture beautiful, battle-tested and tough, we had enough So you either come with some change or it's gon' be rough Period And as a brotha with a good heart, I say ""Fuck you,"" if you racist Or white playin' quiet, you disablin' the changes And fuck bein' famous, tired of watchin' us complainin' Cops kill a brother, get released after arraignments, pshh"
Endangered Species,Ice Cube,Racism,"Peace don't make me laugh! All I hear is motherfuckers rappin' succotash Livin' large, tellin' me to get out the gang I'm a nigga, gotta live by the trigger How the fuck do you figure? That I can say peace and the gunshots will cease? Every cop killer goes ignored They just send another nigga to the morgue A point scored- they could give a fuck about us They rather catch us with guns and white powder If I was old, they'd probably be a friend of me Since I'm young, they consider me the enemy They kill ten of me to get the job correct To serve, protect, and break a niggas neck Cause I'm the one with the trunk of funk And 'Fuck tha Police' in the tape deck You should listen to me cause there's more to see Call my neighborhood a ghetto cause it houses minorities The other color don't know you can run but not hide These are tales from the darkside You wanna free Africa, I stare at yuh Cause we ain't got it too good in America I can't fuck with them overseas My homeboy died over a key of cocaine It was plain and simple The 9mm went ""pop"" to the temple ""pop pop pop"" was the sound I put the bitch down And ran to the schoolyard bathroom Looked in the trash can yo it had room So I ducked my ass in it for a minute Covered with trash I had to lay back Mad as fuck, thinkin' about the payback Tonight the crew gonna have a little fun I went home and cut the barrel of my shotgun It's gettin' critical, I stole a 5.0 I let it go, drive real slow I yelled out 'Ice Cube sucker' The shot-gun kicked, and it murdered motherfuckers I told you last album When I got a sawed off, bodies are hauled off Its a shame, that niggas die young But to the light side it don't matter none It'll be a drive by homicide But to me its just another tale from the dark side Standing in the middle of war In the middle we flex When we die, we won't make Jet +Ebony+ can't see to the light side The term they apply to us is a nigga Call it what you want, cause I'm comin' from the coroner Sayin my rhymes with a Ph.D. Who's black, don't wanna role, sells his soul Watch his head go rollin' Who the fuck are they foolin'? Nobody knows, but I suppose the color of my clothes Matches the color of the one on my face As they wonder whats under my waist Standin' on the verge of them gettin' brown That's a fact got a fear on their bozack Run, run, run, their ass off, they can not hide"
Whats it all about,Run DMC,Racism,"I would like to throw ""Rock Box"" in the start of this one ""Run.. Dee.. Run.. D.. M.. C.."" ""Here we go again!"" -> Chuck D*} ""What's it all about?"" [Repeat x4] Livin' in the city, the crack the mack and all that Easy does it, is it was it The black or white that Friday night In those racist places, let's get it right Ah to the maximum, and keep askin' 'um When the city gonna fix where the blacks are from And every day around the way another one got Bucked in his head, from a gunshot No chance in advance for the ambulance Cause he was just another victim of the circumstance A brother died, the mother cried, it was a pity But that's how it goes down when you're livin' in the city Just a hard rock, call him a hard rock In the metropolis there's no stoppin' this Can't agree with society poppin' this Disagree with the plea when they coppin' it Some men pretend the end will come soon They gather what they can and them BOOM You played yourself, you made your wealth; The deal was dealt, now your health is in question Three Card Molly, hoodlums, who are we? Pollution, prostitution, In God We Need a solution, revolution, substitution For the thing's that we're abusing Pity the city, for the people livin' out on the streets Yo we homeless, the homeless need to eat There's no progress for the rest God bless for less What it is? What's it all about? Whassup G? What it be? How you livin' homeless probably Mandela's free And they're rollin' with D In history you cannot see em like they cannot see me The Berlin Wall It all had to fall They said no but ""Yo!"" ""Yes why'all!"" The people that spoke were never provoked And now it's tumblin' down Freedom of speech for each Now how that sound? Try to stop me from sayin' what I want to say My funky rhyme I never quit until the break of day Now here we go as I flow and show and kick Infor-mation, teach and ? reach inside the nation And be a, seer cause I'm reason with run And now that the point is out Let the jam slam my man and tell me What's it all about? I flex my muscle, what I must do Is bumrush you, fuck you I'll crush you The Ku Klux Klan is fucked up And every good man'll understand Beginnin' and winnin', from the first fuckin' vocal I spoke to you, I ain't no joke to you I do what I want to do If you don't like what me and my crew is doin' then fuck you What I do and what I done with Jay and Run None could ever become, to sum it up bum Get off my dick and out my kingdom (Yo yo D tell em where you're from) Straight from Hollis, Queens I'm still eatin' collard greens and I'm doin' the same things I ain't never goin' out suckers Punk motherfuckers! What's it all about?"
Holler if you hear me,2pac,Racism,"Here we go Turn it up Let's start From block ta block We're snatchin' hearts And jackin' marks And tha punk police can't fade me And maybe We can have peace someday 'G' But right now I got my mind set up Lookin' down tha barrell of my 9 Get up Cause it's time to make tha pay back phat To my brothers on tha block--better stay strapped black And accept no substitutes I bring truth to tha youth tear tha roof off tha ol' school Oh no, I won't turn tha other cheek In case ya can't see us while we burn the other week Now we gotta make it smash Blast How long will it last, till tha broke get more cash Until then Raise up! Tell my young black males Blaze up! Life's a mess don't stress Test I'm givin' Much love to my brothers in tha pen See ya when I free ya If not, when they shut me in Once again, is there no one else strapped Keep ya hands on ya gat Now ya boys watch ya back Cause in tha alleys of cali I'ma tell ya Mess with tha best and tha vest couldn't help ya Scream, if ya feel me See it clearly? your too near me Hollar if ya hear me Hollar if ya hear me Hollar if ya hear me Pump ya fists like this Hollar if ya hear me (pump, pump) if ya pissed To tha sell-outs livin' it up One way or another you'll be givin it up I guess 'cause I'm black boy I'm supposed to say 'peace', sing songs, and get capped on But it's time for tha new plan, BAM! I'll be swingin' like a one man clan Here we go Turn it up Don't stop To my homies on tha block Gettin' dropped by cops I'm still around for ya Keepin' my sound Underground for ya And I'ma throw a changup Quayle, like you never brought my name up Now my homies in tha backstreets Tha blackstreets They fear me when they rollin in they phat jeeps This ain't just a rap song A black song Tellin' all my brothers, get they strap on And look for me in tha struggle Hustlin' to tha other brotha's bubble Hollar if ya hear me Hollar if ya hear me Hollar if ya hear me Will I quit, will I quit? They claimin' that I'm violent But still I kick Representin' Never give up on a good thing Wouldn't stop it if we could It's a hood thing And now I'm like a major threat 'Cause I remind you of the things you were made to forget Bring tha noise To all my boyz Know tha real from tha bustas And the decoys And if ya hustle like a real 'G' Pump ya fists if ya feel me Hollar if ya hear me Learn to survive in tha nine-tre I make crime pay I was in crime pay Whatever it takes to make a stand Cause nobody else'l give a damn So we live like caged beasts Waitin' for tha day to let tha rage free Still me, till they kill me I love it when they fear me Hollar if ya hear me Hollar if ya hear me Hollar if ya hear me"
Neighbors,J Cole,Racism,"I guess the neighbors think I'm sellin' dope, sellin' dope Yeah, the neighbors think I'm sellin' dope, sellin' dope Sellin' dope, sellin' dope, sellin' dope, yeah I don't want no picture with the president I just wanna talk to the man Speak for the boys in the bando And my nigga never walkin' again Apologized if I'm harpin' again I know these things happen often But I'm back on the scene I was lost in a dream, it's alright The team down in Austin I been buildin' me a house back home in the South, ma Won't believe what it's costin' And it's fit for a king, right? Or a nigga that could sing And explain all the pain that it cost him My 16 should've came with a coffin Fuck the fame and the fortune, well, maybe not the fortune But one thing is for sure though, the fame is exhaustin' That's why I moved away, I needed privacy Surrounded by the trees and Ivy League Students that's recruited highly Thinkin', you do you and I do me Crib has got a big ol' backyard My niggas stand outside and pass cigars Filled with marijuana, laughin' hard Thankful that they friend's a platinum star In the driveway there's no rapper cars Just some shit to get from back and forth Just some shit to get from back and forth Welcome to the Sheltuh, this is pure We'll help you if you've felt too insecure To be the star you always knew you were Wait, I think police is at the door Okay, the neighbors think I'm sellin' dope Hm, I guess the neighbors think I'm sellin' dope, sellin' dope The neighbors think I'm, neighbors think I'm I think the neighbors think I'm sellin' dope I guess the neighbors think I'm sellin' dope, sellin' dope Sellin' dope, sellin' dope, sellin' dope Well, motherfucker I am Some things you can't escape Death, taxes, and a ra-cist society that make Every nigga feel like a candidate For a Trayvon kinda fate Even when your crib sit on a lake Even when your plaques hang on a wall Even when the president jam your tape Took a little break just to annotate How I feel, damn it's late I can't sleep 'cause I'm paranoid Black in a white man territory Cops bust in with the army guns No evidence of the harm we done Just a couple neighbors that assume we slang Only time they see us we be on the news in chains, damn Don't follow me Don't follow me Don't follow me Don't follow me Okay, the neighbors think I'm sellin' dope, sellin' dope (Neighbors think I'm) I guess the neighbors think I'm sellin' dope, sellin' dope The neighbors think I'm, neighbors think I'm I think the neighbors think I'm sellin' dope I guess the neighbors think I'm sellin' dope, sellin' dope Sellin' dope, sellin' dope, sellin' dope Well, motherfucker I am I am, I am, I am Motherfucker I am I think the neighbors think I'm sellin' dope I am, I am, I am Well, motherfucker I am So much for integration Don't know what I was thinkin' I'm movin' back to Southside So much for integration Don't know what I was thinkin' I'm movin' back to Southside"
Protect and Serve,UGK,Racism,"fuck the police, fuck the police, fuck the police, fuck the police Mr. copper Mr. copper can we speak? How many niggas do you beat down in a week? And do you get a kick when you beat a nigga down with that muthafuckin' stick So you can suck a nigga dick Rodney King really fucked me up at first But at least he didn't go home in no hearse A lot of niggas dead, a lot of niggas died Cause (pop pop pop) with yo muthafuckin' 9 But no me pappy, I'll cap that badge A ratta-tat-tata-tat-tata-tat-tat uh yea So don't even think about tryin' to play me bitch I'll gat ya down with my fuckin' .38 ya bitch Ya got suga in ya nuts just like them grip niggas Ain't shit without that stick and that fuckin' trigga And yo I think it is my duty To slice some laws thoroughly, cause they killed my nigga Rudy and I don't think that's right The policemen are your friends (but all my niggas say)they're here to protect and serve The policemen are your friends (and all my niggas say)they're here to protect and serve I try to keep my face off the street Cause that 99 always wanna swear It was me at the scene of the crime,I wasn't there Bitch, I was at home with blistered feet Soaking my dogs, with my gal smoking a Swisher Sweet But before I could put my Nikes back on I pulled to the curb by some blue and white tryin' to get there jack on Even though I had the right inspection Tricka they still dick a nigga like an erection Lookin for a muthafuckin' criminal, he ain't here Pussy muthafuckas', what color you painting fear But you can color me bad Like them crackas and there choking But understand the real when its smoking I'm loccin' and smokin', niggas is fightin' fast Now your lil trifling ass is doomed to feel the boom of my titan of class So with my 9 I'll buck up a trick And a crooked cop just might get shot Just for the fuck of it The policemen are your friends (but all my niggas say)they're here to protect and serve The policemen are your friends (and all my niggas say)they're here to protect and serve Fuck the fast laws, make ya blow on the trigga squeeze I don't want to kill a cop I just wanna bust that nigga in his knees And watch him squirm and squeal as I buck him there Get down on the floor ho you ain't goin' no fuckin' where One in yo arms, yo knees, yo shoulda I'm laughin like Joker, now turn your punk ass over, bitch But this ain't for my brotha Its strictly for my niggas whose triggas died undercover, no lovas muthafuckas Suck a dick, I'mma let you tell it Bird state you be diggin' all y'all ass And y'all know ya wanna smell it Fools, so gon' take a sniff And right before ya choke, catch the smoke From the chrome and the spliff Out, nigga, from the clique that don't stop Barkin at a cop with a pocket full of rocks So call the {​coroner}​ and tell him what I said I know ya got a vest so I'm aiming at your head Bloody, red, I'm going to your funeral I'm spraying hoes with lead Fuck respect for the mutherfuckin' dead Cause I don't give a fuck about a punk ass fed I'm splittin' niggas wigs and leavin' pussies on they head And I'll be goddamned if I don't hit, {​killing him}​ Tell {​Moody Harris}​ they gon' want to come and get 'em So ashes to ashes and bless his soul Now bend his ass over so I can fuck him with his stick in his asshole The policemen are your friends (but all my niggas say)they're here to protect and serve The policemen are your friends (and all my niggas say)they're here to protect and serve"
Doing my job,TI,Racism,"Hey I'm working here, know what I'm saying Try to put yourself in my shoes for a second Its not personal I'm just saying though Hey look From when the moon came out 'till the sun came up I was supplying the days when where they flame up Our mamas passing, by trying to explain us Pissing in the bushes like they never house trained us But, try to understand that's how we came up You get to know us, you'll love us but you can't change us (naw) Really we rather be rich and famous But in the mean time were forced to slang dust 'Dro or crack cocaine, Penicillin to Rogaine Ecstacy, Viagra, whatever'll get the dough man I'm tired of people mis-representing my dough man Oh you think we out here killing for nothing, hustling For no gain (picture that) Hey man I'm just doing my job Hey lady, don't mind me I'm just doing my job I don't want to make your life more harder, I'm just doin my job You live here, I work here I'm doing my job I don't know if you don't know, don't care or can't see Every time something up in the hood, it ain't me And I ain't always up to no good and know the crease And we ain't always gotta pass through the hood without speaking (how you doing) We ain't out here threatening your lives, raping your children We just out here staying alive, making a million (you know) Working hard, trying to survive chasing a mill-ion You hear us talking loud, just think of this is chameleon React to the situations, but accusations is still We vulgarizing you how, hey man you just hurting my feelings (man). We got lives, we want to live nice too We got moms, dads, wives, kids just like you But our options are few it hell in high school When your helping with the rent lights and the gas bill too So before you go judging us loving us won't hurt Yeah under 25, staying alive is hard work Hey man I'm just doing my job Hey lady, don't mind me I'm just doing my job I don't want to make your life more harder, I'm just doin my job You live here, I work here I'm doing my job And for you to see what I'm saying, open eyes will help If you could think about somebody besides yourself Why you pointing fingers at me, analyze yourself Quit all that chastising and try to provide some help Instead of calling the law, you busting my balls With all due respect, we don't even need to be fucking with y'all (man) And we can't help it cause it is like this We don't like it no more than you that we live like this Always stuck in the grind summertime to wintertime Cutting school to sell fifty dimes by dinner time See everything we know we learned from the streets Since thirteen I've been hustling and earning my keep Hey man I'm just doing my job Hey lady, don't mind me I'm just doing my job I don't want to make your life more harder, I'm just doin my job You live here, I work here I'm doing my job"
Front Lines,Conway the Machine,Racism,"Uh-huh Yeah Look Machine, bitch, your favorite rappers wanna be me I do their streaming numbers with the vinyl and the CDs (hahaha) Sellin', boy, you know I'm in the toy when you see me You see me, got the Lam' in my name like CD (talk to 'em) I put food in the oven and I ain't talkin' ziti That blue magic had a junkie shootin' like 3D (hah) My neck look 3D 'cause S sittin' next to the VV My bitch the prettiest next to Riri (what up, baby?) See me feedin' the homeless, I needed these moments I'm a boss, not just a rapper, I don't see no opponents A nigga hatin' then he just caught in the heat of the moment (hahaha) Probably 'cause that 650 he see me in, I own it (uh-huh) I can move a pie raw, since Buff had the Aurora with the suicide doors My bro caught a nigga upstate, they threw him five more That grimy rap in the game, tell me who provide more The Machine, nigga (brr, uh, yeah) All my niggas outside, they outside All my niggas outside, we outside (we outside) If it's pressure then we gon' slide (we slidin') Hope you got your gun, you know I got mines (brr, yeah) If it's pressure then we gon' slide (slide) All my niggas outside, they outside (yeah) All my niggas outside My nigga got his, in the can and he doin' forty flat My nigga took his time like a G and that's a fact (Yeah) Always in good spirits when he hit me on the jack While you so called real niggas celebratin' rats Goin' on YouTube, runnin' up these niggas' views Can't be on both sides, my nigga, you gotta choose (you gotta choose) Nigga try to justify this shit in all his interviews And the niggas in the comments say they would've did it too (uh-huh) I just seen a video on the news I couldn't believe (nah) Another racist cop kill a nigga and get to leave (again?) He screamin', ""I can't breathe"", cop ignorin' all his pleas Hands in his pocket, leanin' on his neck with his knees (psh) Cracker invent the laws, that's why the system is flawed Cops killin' black people on camera and don't get charged We ain't takin' no more, we ain't just pressin' record Can't watch you kill my brother, you gon' have to kill us all Just 'cause he from the ghetto, that don't mean he sellin' crack He drivin' home from work, you pull him over 'cause he black Think he gangbangin' 'cause he got dreads and a few tats He reach for his ID, you think he reachin' for a strap He get out, put his hands up, and he still gettin' clapped But if he try to run, you just gon' shoot him in his back What if it was my son? I wonder how I'm gon' react I bet I'm finna run up in this precinct with this MAC (brr) I swear to God All my niggas outside, they outside All my niggas outside, we outside (we outside) If it's pressure then we gon' slide (we slidin') Hope you got your gun, you know I got mines (brr, yeah) If it's pressure then we gon' slide (slide) All my niggas outside, they outside (yeah) All my niggas outside, we outside So, I'm gonna let you see the pictures for yourself This is the 3rd precinct here There are fires burning to the left of it at the Uh, wine, liquor store, uh, on your left, but back In the back of the precinct, you are hearing people throwing things against the the walls Against the glass, against anything they can And now the fire alarm, you'll see it flashing, inside of the 3rd precinct Behind the 3rd precinct, just behind it Is a, a fire that is, is billowing It has been going for a few minutes now, uh, really strongly But you hear people cheering every time they get through one of the windows there, uh With whatever it is they're throwing It sounds like they're throwing, you can see, uh, pieces of concrete Uh, there's someone climbing up the wall right now On the back of the 3rd precinct Uh, kicking the window in, trying to climb up the wall People are trying to get in the building We're listening to people say that they're trying to get into the building"
