Name,Artist,Topic,Lyrics
Crooked Officer,Geto Boys,Racism,"Pigs dying from bullet wounds to the chest I'm sick of you hoes trying to run mine I'm coming with a gun line running after one time I got a grudge against you blue suits Black suits, white suits and state troops That's the way you made us Send a nigga to the penitentiary is how you play us Lock us up for the summer Took a nigga's name away and passed his ass a number Just because you legally pack a gat man Doesn't necessarily mean you have to point it at the black man Especially you black cops, you let your gats pop Because them honkies got you brainwashed So now we come to new dealings Fuck all the dumb shit The line of work is cap peelings I'm cutting shit short Ain't no filling out reports 'Cause you ain't making it to court I'm letting freedom ring From the hole in my Glock, for fuckin' off Rodney King It ain't nothing you can ask us And since justice is blind I'ma buy the bitch some glasses Wake the fuck up, chucks I'm coming after your ass Crooked officer Mr. Officer, crooked officer I wanna put your ass in a coffin, sir 'Cause you done fucked with niggas like myself for too long It's time to grab my motherfucking nine and get it on Mr. Officer, crooked officer I wanna put your ass in a coffin, sir 'Cause you done fucked with niggas like myself for too long It's time to grab my motherfucking shit and get it on Oh Mr. Officer, crooked officer, what's happenin'? You beat another black man's ass and now you're high cappin' Friend, do I have to move to River Oaks And bleach my fuckin' skin so I can look like these white folks? Just to get some assistance Because the brutality in my neighborhood is gettin' persistent 'Cause you wanna harass me Yeah, and if I talk back you wanna bust my black ass, G Just like Rodney King But if you try that shit with me, its gonna be a different scene Try to pull me over on a dark road But I'll be damned if I don't grab my nine and unload Until every blue shirt turns red You heard what I said I want all you crooked motherfuckers dead So you better start pickin' out your coffin, sir 'Cause I'm comin' after your ass Mr. Officer, crooked officer I wanna put your ass in a coffin, sir 'Cause you done fucked with niggas like myself for too long It's time to grab my motherfucking nine and get it on Mr. Officer, crooked officer I wanna put your ass in a coffin, sir 'Cause you done fucked with niggas like myself for too long It's time to grab my motherfucking shit and get it on Momma called me up the other day, I got a warrant Punk ass laws wanna know where the gun went Said I shot a nigga the other day at a party Lyin' out they ass, I was at home drinkin' 40s Coolin' with my niggas playin' dominoes in the kitchen A big black nigga did the killin' and I fit the description Yeah, and you know they think all black niggas look alike So now they got the flashlight lookin' for Big Mike Jackin' niggas up tryin' to capture me Coppers wanna gaffle me Tryin' to put bullets into the back of me Time and time again I told them I didn't do it And they knew it, but they still pursued it So them motherfuckers blew it So now I'm about to grab my shit And put them son of a bitches six feet under 'Cause I'm sick of runnin' from them motherfuckers Turnin' tables 'cause I'm able, I ain't fallin' victim Time to play a game, see the police, watch me stick 'em 'Cause I ain't runnin' from a p-o-l-i-c-e Any motherfuckin' t-i-m-e They'll have to g-e-t me Off the s-e-t in my h-double o-d Fuckin' around with the B-i-g They'll be in a g-r-a-v-e Mr. Officer, crooked officer I wanna put your ass in a coffin, sir 'Cause you done fucked with niggas like myself for too long It's time to grab my motherfucking nine and get it on Mr. Officer, crooked officer I wanna put your ass in a coffin, sir 'Cause you done fucked with niggas like myself for too long It's time to grab my motherfucking shit and get it on"
One four love,Hip Hop for Respect,Racism,"Yo, you sent out the signal right? And this is what happened The voice of Hip Hop got heard Never compromised This is how we put it down, c'mon! Throughout my thug life, I've seen the most trife Like toast lightin' over the role of dice Flash your whole life when killers on a heist Sold them tight, get poltergeisted over the bowl of Christ Who pulled the slice from cats aiming gats at shoulder height Told you, right? G be the one that come and hold the mic And aim it at the whole vice squad that's out patrolling nights Rollin' like every prototype *nigga* was Dolomite One man be cold as ice. Inside his gun hand, he holds for life This for those who pose in they grave Waitin' for they peace when the law misbehave I say we fall deep, watch 'em walk the beat Like, ""You can't cross streets""—make 'em all retreat (Now) Judges and the jury be a little too acquainted Ending up defendants when we 'sposed to be the plaintiffs Laugh now cause soon the thrill stops When heads get it on and start to kill cops I'm sober, they pulled me over What I do, yo? (what we do, yo?) Po-po go, ""I'm drivin' too slow"" (cool, yo) Eyes tourin' them, explorin' them (damn) Four of 'em—that's why I'm ignorin' them (uh-oh) Think quick, brain like King Skip Before they bring this to some Rodney King *shit* (Forget them fools) Naw, make no sudden moves They reachin' for they tools (let's move) You buggin', dubes Kirk, you ran the stop? (nah) Word, them pigs frontin' (uh) Yo, tell like you tell 'em cousin—we ain't did nothin' All they see is three blacks in a jeep with seats back Lookin' for G-packs, how the blood dog can eat that They thirstin' for a reason to blast, you can't peep that Gats and a badge to match—you can't beat that, so bounce 'em My people unite and let's all get down We gotta have what? Love, peace, and understandin' One god, one love, one light One aim, one voice, one fight My people unite, hop up, and do it right We gotta have what? Love, peace, and understandin' One god, one love, one light One aim, one voice, one fight My people unite, hop up, and do it right Do it right ya'll, keep it tight ya'll Do it right ya'll, just do it Blood on my mans, destroying the fam' More soldiers die, another mother cries Anthony Baez, Eleanor Bumpurs, Diallo Let it keep happenin' and there's more to follow It's even deeper than that, penal shot in the back Forever we fight and cuss, but the world still adjust So many bullets just to stop one man Is that the plan? To leave us all dead in the street? I'm an opponent of violence Too many of my guys have become moments of silence Law takes lives and condone it through sirens And night sticks, I write quick hoping that I might hit somebody in the heart Like a arrow with her eyes on a sparrow Yo, I feel my people pain all in my bone marrow I'm tellin' Pharaoh to let my folks go Marcs is singin' to law like they background vocals Local, state, federal cops are being payed properly To protect the property, how can I just stand by Watch a man die for nothin' and not react The way we spit on this track is how we bustin' back Yo, I pimp slap 5-0 Get behind them and make them marks drive slow Yo, you wanna know how to improve on the quality of life? Try respectin' it; step in my zone with that madness And I'm checking it Cops, they transport me from Long island to Medina With they *fucked* up demeanor Dreamin' of stickin' it to me like Abner Louima Pharoahe slash el-Hajj Malik Shabazz in the flesh With plans of retaliations for you coward *ass* God, please allow me to preach for him A voiceless man through a spirit—I speak for him Step to city hall, for delf, do it for dolo With visions of cops inside the Public Enemy logo All that schemin' and plottin' The young absorb like cotton Especially in my city where the poor steady rottin' and You would thought 5-0 would cut it all short But they play the biggest part in the art of livin' wrong In our land, cops guns clap more than hands As if we don't deserve what they here to preserve We just tryna do it right in these boroughs that we reppin' in Why they tryna fill us with more lead than Zeppelin? My people unite and let's all get down We gotta have what? Love, peace, and understandin' One god, One love, One light One aim, One voice, One fight My people unite and let's all get down We gotta have what? Love, peace, and understandin' One god, One love, One light One aim, One voice, One fight My people unite and let's all get down We gotta have what? Love, peace, and understandin' One god, One love, One light One aim, One voice, One fight My people unite and let's all get down We gotta have what? Love, peace, and understandin' One god, One love, One light One aim, One voice, One fight"
Police State,dead Prez,Racism,"You have the emergence in human society Of this thing that's called the State What is the State? The State is this organized bureaucracy It is the police department It is the Army, the Navy It is the prison system, the courts, and what have you This is the State, it is a repressive organization But the state and gee, well, you know You've got to have the police, 'cause If there were no police, look at what you'd be doing to yourselves! You'd be killing each other if there were no police! But the reality is The police become necessary in human society Only at that junction in human society Where it is split between those who have and those who ain't got I throw a Molotov cocktail at the precinct You know how we think Organize the hood under I-Ching banners Red, Black and Green instead of gang bandanas F.b.i. Spyin' on us through the radio antennas And them hidden cameras in the streetlight watchin' society With no respect for the people's right to privacy I'll take a slug for the 'cause like Huey P. While all you fake niggas try to copy Master P I want to be free to live, able to have what I need to live Bring the power back to the street, where the people live We sick of workin' for crumbs and fillin' up the prisons Dyin' over money and relyin' on religion for help We do for self like ants in a colony Organize the wealth into a socialist economy A way of life based off the common need And all my comrades is ready, we just spreadin' the seed The average Black male Live a third of his life in a jail cell 'Cause the world is controlled by the white male And the people don't never get justice And the women don't never get respected And the problems don't never get solved And the jobs don't never pay enough So the rent always be late, can you relate? We livin' in a police state No more bondage No more political monsters No more secret space launchers Government departments started it in the projects Material objects, thousands up in the closets Could've been invested in a future for my comrades Battle contacts, primitive weapons out in combat Many never come back Pretty niggas be runnin' with gats Rather get shot in they back than fire back We tired of that, corporations hirin' blacks Denyin' the facts, exploitin' us all over the map That's why I write the shit I write in my raps It's documented, I meant it Every day of the week, I live in it, breathin' it It's more than just fuckin believin' it I'm holdin' them ones, rollin' up my sleeves an' shit It's cee-lo for push-ups now, many headed for one conclusion Niggas ain't ready for revolution The average Black male Live a third of his life in a jail cell 'Cause the world is controlled by the white male And the people don't never get justice And the women don't never get respected And the problems don't never get solved And the jobs don't never pay enough So the rent always be late, can you relate? We livin' in a police state"
Juice (know the ledge),Rakim and Eric B.,Racism,"Sip the juice I got enough to go around, And the thought takes place uptown I grew up on the sidewalk where I learned street talk, And then taught to hawk New York I go to Queens for queens to get the crew from Brooklyn, Make money in Manhattan and never been tooken, Go Uptown and the Bronx to boogie down, Get strong on the Island, recoup, and lay around Time to build my juice back up Props back up, suckers get smacked up Don't doubt the clout, you know what I'm about Knocking niggas off, knocking niggas out Shaking em up, waking em up Raking em up, breaking em up Standing on shaky grounds too close to the edge Let's see if I know the ledge Corners trifling cause Shorty's here I get cock d liffin' forty's of beer Here's a sip for the crew that's deceased, If I get revenge, then they rest in peace. Somebody's got to suffer, I just might spare one And give a brother a fair one Stay alert and on p's And I do work with these like Hercules, Switch to southpaw, split your right jaw 'Cause I don't like y'all, I'm hype when night fall. Smooth but I move like an army Bulletproof down in case brothers try to bomb me, Putting brothers to rest like Elliot ness 'Cause I don't like stress Streets ain't a place for innocent bystanders to stand Nutting's gonna stop the plan I'll chill like Pacino, kill like DeNiro Black Gambino, die like a hero Living on shaky grounds too close to the edge Let's see if I know the ledge Shells lay around on the battleground Dead bodies are found throughout the town Tried to put shame in my game to make a name Imma put it on a bullet, put it in your brain. Rip the block like a buckshot, Who cares where it goes, just keep the casket closed, No remorse when a life is lost I paid my dues, paid the cost And my pockets are still fat, Wherever I'm at, I get the welcome mat Even if my crew steep with one deep I attract attention, people like to peep So come say hi to the badguy Don't say goodbye, I don't plan to die 'Cause I get loose and I got troops And crazy juice! In control of many like Ayatollah Khomeini Hang out wit Smith and Wesson, don't try to play me I'm at war alot, like Anwar Sadat But no warning shot, my gun is warm alot When I cook beef, the smoke will never clear, Areas in fear but this here's a fear Living life too close to the edge Hoping that I know the ledge A brand new morn, no time to yawn Showers on, powers on Late for school, I catch the train Girls sip Cristal and whisper my name I push up like an exercise, Check the intellect and inspect the thighs Select the best one, pull her to the side Keep her occupied for the rest of the ride Read my resume she's know I'm 'ready cool Just meet me after school, We can moan and groan until your mom come home, And you be calling me Al dope Capone. Sweatin' me, she didn't want to let me loose Come get me, that's if you want to sip the juice Cause the streets await me, so I take my gun off safety Cause alot of niggas hate me Coming out of the building, they set me up Sprayed wit automatics, they wet me up In a puddle of blood, I lay close to the edge I guess I didn't know the ledge"
A Song for Assasta,Common,Racism,"In the Spirit of God In the Spirit of the Ancestors In the Spirit of the Black Panthers In the Spirit of Assata Shakur We make this movement towards freedom For all those who have been oppressed, and all those in the struggle Yeah, yo, check it There were lights and sirens, gunshots firing Cover your eyes as I describe a scene so violent Seemed like a bad dream, she laid in a blood puddle Blood bubbled in her chest, cold air brushed against open flesh No room to rest, pain consumed each breath Shot twice wit her hands up Police questioned but shot before she answered One Panther lost his life, the other ran for his Scandalous the police were as they kicked and beat her Comprehension she was beyond, tryin' to hold on To life. She thought she'd live with no arm That's what it felt like, got to the hospital, eyes held tight They moved her room to room-she could tell by the light Handcuffed tight to the bed, through her skin it bit Put guns to her head, every word she got hit ""Who shot the trooper?"" they asked her Put mace in her eyes, threatened to blast her Her mind raced till things got still Opened her eyes, realized she's next to her best friend who got killed She got chills, they told her, that's where she would be next Hurt mixed wit anger-survival was a reflex They lied and denied visits from her lawyer But she was building as they tried to destroy her If it wasn't for this German nurse they would of served her worse I read this sister's story, knew that it deserved a verse I wonder what would happen if that would of been me? All this shit so we could be free, so dig it, y'all I'm thinkin' of Assata, yes Listen to my Love, Assata, yes Your Power and Pride is beautiful May God bless your Soul It seemed like the middle of the night when the law awakened her Walkie-talkies crackling, I see 'em when they taking her Though she kinda knew, What made the ride peaceful was the trees and the sky was blue Arrived to Middle-sex Prison about six inna morning Uneasy as they pushed her to the second floor in A cell, one cot, no window, facing hell. Put in the basement of a prison wit all males And the smell of misery, seat-less toilets and centipedes She'd exercise, (paint?, ) and begin to read Two years in a hole. Her soul grew weak Away from people so long she forgot how to speak She discovered freedom is a unspoken sound And a wall is a wall and can be broken down Found peace in the Panthers she went on trial with One of the brothers she had a child with The foulness they would feed her, hopin she's lose her seed Held tight, knowing the fight would live through this seed In need of a doctor, from her stomach she's bleed Out of this situation a girl was conceived Separated from her, left to mother the Revolution And lactated to attack hate Cause federal and state was built for a Black fate Her emptiness was filled with beatings and court dates They fabricated cases, hoping one would stick And said she robbed places that didn't exist In the midst of threats on her life and being caged with Aryan whites Through dark halls of hate she carried the light I wonder what would happen if that would of been me? All of this shit so we could be free. Yeah, I often wonder what would happen if that would f been me? All of this shit so we could be free, so dig it, people I'm thinkin' of Assata, yes Listen to my Love, Assata, yes Your Power and Pride is beautiful May God bless your Soul Yo From North Carolina her grandmother would bring News that she had had a dream Her dreams always meant what they needed them to mean What made them real was the action in between She dreamt that Assata was free in they old house in Queens The fact that they always came true was the thing Assata had been convicted of a murder she couldna done Medical evidence shown she couldna shot the gun It's time for her to see the sun from the other side Time for her daughter to be by her mother's side Time for this Beautiful Woman to become soft again Time for her to breathe, and not be told how or when She untangled the chains and escaped the pain How she broke out of prison I could never explain And even to this day they try to get to her But she's free with political asylum in Cuba. I'm thinkin' of Assata, yeah Listen to my Love, Assata, yeah We're molded from the same mud, Assata We share the same Blood, Assata, yeah Your power and pride, so beautiful May God bless your soul Your power and pride, so beautiful May God bless your soul Freedom! You askin' me about freedom Asking me about freedom? I'll be honest with you I know a whole more about what freedom isn't Than about what it is, cause I've never been free I can only share my vision with you of the future About what freedom is Uh, the way I see it Freedom is, is the right to grow, is the right to blossom Freedom is is the right to be yourself, to be who you are To be who you want to be, to do what you want to do"
The Ghetto,Too Short,Racism,"Talking 'bout the ghetto Funky, funky ghetto Trying to survive Trying to stay alive The ghetto The ghetto (talking 'bout the ghetto) The ghetto (hmm) The ghetto (funky, funky ghetto) Even though the streets are bumpy, lights burned out Dope fiends die with a pipe in their mouths Old school buddies not doing it right Every day it's the same And it's the same every night I wouldn't shoot you, bro, but I'd shoot that fool If he played me close and tried to test my cool Every day I wonder just how I'll die Only thing I know is how to survive There's only one rule in the real world And that's to take care of you, only you and yours Keep dealing with the hard times day after day Might deal me some dope, but then crime don't pay Black man tried to break in my house again Thought he got off the dope doing time in the pen Even though my brothers do me just like that I get a lot of love so I'm giving it back to the ghetto The ghetto (talking 'bout the ghetto) The ghetto (funky, funky ghetto) The ghetto (trying to live our lives) The ghetto (won't ya tell 'em 'bout it, Too $hort?) So just peep the game and don't call it crap 'Cause to me, life is one hard rap Even though my sister smoked crack cocaine She was nine months pregnant, ain't nothing changed 600 million on a football team And her baby died just like a dope fiend The story I tell is so incomplete Five kids in the house, no food to eat Don't look at me and don't ask me why Mama's next door getting high Even though she's got five mouths to feed She'd rather spend her money on a H-I-T I always tell the truth about things like this I wonder if the mayor overlooked that list Instead of adding to the task force, send some help Waiting on him, I'd better help myself Housing authority and the O.P.D All these guns just to handle me in the ghetto The ghetto (people are dying) The ghetto (children are crying) The ghetto (don't have enough to eat) The ghetto (don't even have shoes on their feet) The ghetto Even though they put us down and call us animals We make real big banks and buy brand new clothes Drive fancy cars, make love to stars Never really saying just who we are We use alias names like Too $hort Sell you stuff you might kill for Young kids grow up and that's all they know Didn't teach him in school, now he's slangin' dope Only thing he knows is how to survive But will he kill another brother before he dies? In the ghetto, you keep one eye open All day long, just hoping and hoping You can pay your bills and not drink too much Then the problems of life you'll be throwing up Like me, but you don't see Ten years from now, where will you be? The ghetto (talking 'bout the ghetto) Trying to get out of the ghetto The ghetto (talking 'bout the ghetto) But I got no place to go The ghetto (talking 'bout the ghetto) Trying to survive in the heart of the ghetto The ghetto (talking 'bout the ghetto) Ha, 'cause that's the only place that I know So much game in a Too $hort rap Can't be white and whites can't be black Why you wanna act like someone else? All you gotta do is just be yourself We're all the same color underneath Short dog is in the house you'd better listen to me Never be ashamed of what you are Proud to be black, stand tall at heart Even though some people give you no respect Be intelligent, when you put 'em in check 'Cause when you're ignorant, you get treated that way And when they throw you in jail, you got nothing to say So if you don't listen, it's not my fault I'll be getting paid and you'll be paying the cost Sitting in the jailhouse, running your mouth While me and my people try to get out The ghetto (talking 'bout the ghetto) Talking 'bout the ghetto The ghetto (talking 'bout the ghetto) Funky, funky ghetto The ghetto (talking 'bout the ghetto) Trying to survive The ghetto (talking 'bout the ghetto) Trying to stay alive The ghetto (talking 'bout the ghetto) Funky, funky ghetto The ghetto (talking 'bout the ghetto) Got no place else to go The ghetto (talking 'bout the ghetto) Trying to stay alive The ghetto (talking 'bout the ghetto) Source: Musixmatch"
