Name,Artist,Topic,Lyrics
Where this flower blooms,Tyler the Creator,Other,"Ayo Let's take it back to them days Counting sheep on Sadie Hannah's floor Carpet was my baby mama 80 dollar profit from the coffee I poured Rent-A-Center calling everyday Nobody home, they're knocking on the door Now I skrrt, skrrt, skrrt, skrrt In toys I only dreamed that I could afford Now I roll through Okaga, California I ride to California These frog oval goggles I'm leaning out the window OJ shining on me Simp-Sun shining on me Slick circles floating out this world Yea yea Run it, run it, run it, run it I rock, I roll, I bloom, I glow (I glow) I rock, I roll (what you say?), I bloom, I glow (I glow) I rock, I roll (let 'em know), I bloom, I glow (I glow) I rock, I roll (One more time), I bloom, I grow (Let's go!) Ain't nobody fucking with T, but that may just be my ego But don't be too cool, you may freeze Because niggas get stuck in the cold (man, look at this ice) Shit weighs a ton, water your garden my nigga and stunt (Stunt on these niggas) Tell these black kids they could be who they are Dye your hair blue, shit, I'll do it too Look, I smell like Chanel I never mall grip with my manicured nails I coconut oil the skin I keep the top low 'cause the follicles thinnin' But other than that, man, it feels like I'm winning Went from statistic to millionaire CNN doubted 'cause my skin is dark But they forget when I get in my car These frog oval goggles I'm leaning out the window OJ shining on me Simp Sun shining on me Slick circles floating Vro we off this world (yeah yeah) Run it, run it, run it, yo I glow (I glow) I rock, I roll (what you say?), I bloom, I glow (I glow) I rock, I roll (let 'em know), I bloom, I grow (I grow) I rock, I roll (one more time), I bloom, I- (Let's go!) Flower boy T, nigga that's me Rooted from the bottom, bloomed into a tree Took a little while, nigga making leaves Keep 'em in the branches so my family can eat Favorite color green, energy is strong Giving niggas life like birdies and the beez Dropping them seeds, not what you want You don't know what I keep in the trunk Ah, shit! Run it, run it, run it, run it Run it Run it Run it"
Ether ,Nas,Other,"What's up niggas, hey yo, I know you ain't talking 'bout me dog You, what? (""Fuck Jay-Z"") You been on my dick nigga, you love my style, nigga (""Fuck Jay-Z"") Fuck with your soul like ether (Will) Teach you the king you know you (Not) ""God's son"" across the belly (Lose) I prove you lost already Brace yourself for the main event Y'all impatiently waiting It's like an AIDS test, what's the results? Not positive, who's the best? Pac, Nas and Big Ain't no best, East, West, North, South, flossed out, greedy I embrace y'all with napalm Blows up, no guts, left chest, face gone How could Nas be garbage? Semi-autos at your cartilage Burner at the side of your dome, come outta my throne I got this, locked since '9-1 I am the truest, name a rapper that I ain't influenced Gave y'all chapters but now I keep my eyes on the Judas With Hawaiin Sophie fame, kept my name in his music Check it Fuck with your soul like ether (Will) Teach you the king you know you (Not) ""God's son"" across the belly (Lose) I prove you lost already Hey yo, pass me the weed, pour my ashes out on these niggas man (no doubt) Hey , y'all fagots, y'all kneel and kiss the fuckin ring Fuck with your soul like ether (Will) Teach you the king you know you (Not) ""God's son"" across the belly (Lose) I prove you lost already I've been fucked over, left for dead, dissed and forgotten Luck ran out, they hoped that I'd be gone, stiff and rotten Y'all just piss on me, shit on me, spit on my grave (uh) Talk about me, laugh behind my back but in my face Y'all some ""well wishers, "" friendly acting, envy hiding snakes With your hands out for my money, man, how much can I take? When these streets keep calling, heard it when I was sleep That this Gay-Z and Cockafella Records wanted beef Started cocking up my weapon, slowly loading up this ammo To explode it on a camel, and his soldiers, I can handle This for dolo and it's manuscript, just sound stupid When KRS already made an album called Blueprint First, Biggie's ya man, then you got the nerve to say that you better than Big Dick sucking lips, whyn't you let the late, great veteran live ""God's son"" across the belly, I prove you lost already The king is back, where my crown at? (I'll, will) Ill Will rest in peace, let's do it niggas Fuck with your soul like ether (Will) Teach you the king you know you (Not) ""God's son"" across the belly (Lose) I prove you lost already Y'all niggas deal with emotions like bitches What's sad is I love you 'cause you're my brother You traded your soul for riches My child, I've watched you grow up to be famous And now I smile like a proud dad, watching his only son that made it You seem to be only concerned with dissing women Were you abused as a child, scared to smile, they called you ugly? Well life is hard, hug me, don't reject me Or make records to disrespect me, blatant or indirectly In '88 you was getting chased through your building Calling my crib and I ain't even give you my numbers All I did was gave you a style for you to run with Smiling in my face, glad to break bread with the god Wearing Jaz chains, no tecs, no cash, no cars No jail bars Jigga, no pies, no case Just Hawaiian shirts, hanging with little Chase You a fan, a phony, a fake, a pussy, a Stan I still whip your ass, you thirty-six in a karate class You Tae-bo hoe, trying to work it out, you tryna' get brolic? Ask me if I'm trying to kick knowledge Nah, I'm trying to kick the shit you need to learn though That ether, that shit that make your soul burn slow Is he Dame Diddy, Dame Daddy or Dame Dummy? Oh, I get it, you Biggie and he's Puffy Rockafeller died of AIDS, that was the end of his chapter And that's the guy y'all chose to name your company after? Put it together, I rock hoes, y'all rock fellas And now y'all try to take my spot, fellas? Philly's hot rock fellas, put you in a dry spot, fellas In a pine box with nine shots from my glock, fellas Foxy got you hot 'cause you kept your face in her puss What you think, you getting girls now 'cause of your looks? Ne-gro please You no mustache having, with whiskers like a rat Compared to Beans you wack And your man stabbed Un and made you take the blame You ass, went from Jaz to hanging with Caine, to Herb, to Big And, Eminem murdered you on your own shit You a dick-riding fagot, you love the attention Queens niggas run you niggas, ask Russell Simmons Ha, R-O-C get gunned up and clapped quick J.J. Evans get gunned up and clapped quick Your whole damn record label gunned up and clapped quick Shaun Carter to Jay-Z, damn you on Jaz dick So little shorty's getting gunned up and clapped quick How much of Biggie's rhymes is goin' come out your fat lips? Wanted to be on every last one of my classics You pop shit, apologize, nigga, just ask Kiss"
The Void,Kid Cudi,Other,"Na-na, hmm Na-na, hmm I will fall in the void, fall in the void just to avoid Anything that can bring me down or fuck with my flow Fall in the void (The void) Fall in the void (The void) I will fall in the void, fall in the void just to avoid Anything that can bring me down or fuck with my flow Fall in the void (The void) Fall in the void (The void) Hey, oh, need to free my mind, ah, yeah This is a little ritual of mine as I head home Head up high, get some Hello, sailin' by, nah-nah Say, oh, been dead and alive, don't know Let go, they say I'll survive If you say so, please don't lie My days are low, I'll give it a try, hey See new things in my soul When I'm just sittin' in my room all alone This is the real, it's how I roll Tell my friends and folks that I'm on a ride, don't know when I'm comin' home Things might change, but I'm cool with it Flyin' higher than I've ever been, I see the world just as it is Please hear me, no, no, no, I cannot wait (No, no) As we climb, I'm soarin' I will fall in the void, fall in the void just to avoid (Woah) Anything that can bring me down or fuck with my flow Fall in the void (The void, mmm, yeah) Fall in the void (The void, fall in the void) I will fall in the void, fall in the void just to avoid (Woah) Anything that can bring me down or fuck with my flow Fall in the void (The void, mmm) Fall in the void (The void, bring me, ooh) Oh See ya, never have I flown so high Feel a feeling takin' over, goodbye (Ooh) Be just what you need to be, let's go (Ooh) Everything is all on me, don't count me out (Yo) These nights, they save him from my hellhole When it's dark and my heartbeat echoes Yeah, that's just what I love, ooh Heaven ain't too far now Show me what I don't know (What I don't know) Imagine these things so simple, break the code 'Round and 'round, my mind is throwed Prayin' I overdose on this love, it got me flyin', I'm headed home (Hey) And I'm thinkin' I be dreamin', lights are gleamin' God watchin', haters plottin', but I can't be focused on that Here it goes, this the part, I cannot wait Don't ask why I'm soarin' I will fall in the void, fall in the void just to avoid Anything that can bring me down or fuck with my flow Fall in the void (The void) Fall in the void (The void, fall in the void) I will fall in the void, fall in the void just to avoid (Woah) Anything that can bring me down or fuck with my flow Fall in the void (The void, mmm-mmm, no, no) Fall in the void (The void, come, baby, oh) Oh, no, no Oh, God, oh, God, thank You You've been in my dreams, you've been in my dreams Oh, I'm just trying to be the best man I can be, mmm-mmm Thank you for listening Thank you for never leaving me It's gon' be okay It's gon' be okay I promise you I promise you"
Regulate,Warren G,Other,"Regulators, we regulate any stealing of his property And we damn good too, but you can't be any geek off the street Gotta be handy with the steel if you know what I mean to earn your keep Regulators, mount up It was a clear black night, a clear white moon Warren G was on the streets, trying to consume Some skirts for the eve, so I can get some funk Just rollin' in my ride, chillin' all alone Just hit the Eastside of the LBC On a mission trying to find Mr. Warren G. Seen a car full of girls ain't no need to tweak All you skirts know what's up with 213 So I hooks a left on the 21 and Lewis Some brothas shootin' dice so I said, ""Let's do this"" I jumped out the ride, and said, ""What's up?"" Some brothas pulled some gats so I said, ""I'm stuck"" Since these girls peepin' me, I'ma glide and swerve These hookers lookin' so hard they straight hit the curb Won'tcha think of better things than some horny tricks I see my homey and some suckers all in his mix I'm gettin' jacked, I'm breakin' myself I can't believe they taking Warren's wealth They took my rings, they took my Rolex I looked at the brotha said, ""Damn, what's next?"" They got my homey hemmed up and they all around Ain't none of them seeing if they going straight pound for pound I gotta come up real quick before they start to clown I best pull out my strap and lay them busters down They got guns to my head, I think, I'm going down I can't believe this happenin' in my own town If I had wings I could fly, let me contemplate I glanced in the cut and I see my homey Nate Sixteen in the clip and one in the hole Nate Dogg is about to make some bodies turn cold Now they droppin' and yellin', it's a tad bit late Nate Dogg and Warren G had to regulate I laid all them busters down, I let my gat explode Now I'm switching my mind back into freak mode If you want skirts sit back and observe I just left a gang of those over there on the curb Now Nate got the freaks and that's a known fact Before I got jacked, I was on the same track Back up back up 'cause it's on N A T E and me, the Warren to the G Just like I thought, they were in the same spot In need of some desperate help the Nate Dogg and the G-child Were in need of something else, one of them dames was sexy as hell I said ""Ooo I like your size"" She said, ""My car's broke down and you seem real nice Would ya let me ride?"" I got a car full of girls and it's going real swell The next stop is the Eastside Motel I'm tweaking into a whole new era G-Funk, step to this, I dare ya Funk, on a whole new level The rhythm is the bass and the bass is the treble Chords, strings We brings melody G-Funk, where rhythm is life And life is rhythm If you know like I know You don't wanna step to this It's the G-Funk era Funked out with a gangsta twist If you smoke like I smoke Then you high like everyday And if your ass is a buster 213 will regulate"
Good Night,Denzel Curry,Other,"Even if they hit me on sight Everything gon be alright Everybody have a good night We gon' make it to the daylight It's ironic how it's crabs in the bucket but I'm coming from the sea Snapping at me, the poetry Dead on the street 'cause they lost in hate Jit wanna get his stripes, eat some Frosted Flakes Off to say communities we have no place Even though the real victim is who caught the case My Golden State all about the green, Draymond Stay away from being a convict, Akon Come to Carol City where the fun don't end 'Till a nigga get to dumping like an ex-girlfriend Stay in, bow your head we prayin' For a bad bitch able to come on the weekend (uh!) And if I said it I did it in pretense (uh!) If you don't get it then please just pretend I spied through my mahogany brown eyes The sun will still rise, I thank the most high The sun will keep on shining (I'mma keep on shining) The sun gon' keep on shining Give love to the most high God Even if they hit me on sight Everything gon' be alright Everybody have a good night We gon' make it to the daylight Even if they hit me on sight Everything gon' be alright Everybody have a good night We gon' make it to the daylight I can't even begin to explain the type of epidemics representing Carol City Killing then little youngins really ill in these streets We tryna make a way to put the foolishness to sleep Keep mixing the antidote No nonsense my mama metallic gold Play my cards just 'cause it's harder come to recognize I got a clean slate And finally getting to the point of feeling free-ee Hovers my energy Body scars put the pain in my heartbeat so I gotta drop ether We touch the soul because we young niggas that gotta eat They perpetrating promoting the shit they gotta reap My family is the reason that I even speak Every decent memory of people still be living shife And you ain't really gotta die to lose your life Think about it, it's a lot of niggas living outta sight How 'bout you niggas ride the pipe as we reaching higher heights The sun will keep on shining (I'mma keep on shining) The sun gon' keep on shining Give love to the most high God Even if they hit me on sight Everything gon' be alright Everybody have a good night We gon' make it to the daylight Even if they hit me on sight Everything gon' be alright Everybody have a good night We gon' make it to the daylight"
Gin N Juice,Snoop Dogg,Other,"I'm serious nigga one of y'all niggas got some bad motherfucking breath Oh man aye baby, aye baby, shit, Aye baby get some bubblegum in this motherfucker or something Aye, nigga, get something to eat, dog Study long, study wrong nigga With so much drama in the L-B-C It's kinda hard being Snoop D-O-double-G But I, somehow, some way Keep coming up with funky ass shit like every single day May I, kick a little something for the G's And, make a few ends as I breeze, through Two in the morning and the party's still jumping 'Cause my momma ain't home I got bitches in the living room getting it on And, they ain't leaving 'til six in the morning, six in the morning So what you wanna do, shit I got a pocket full of rubbers and my homeboys do too So turn off the lights and close the doors But—but what?—we don't love them hoes So we gon' smoke a ounce to this G's up, hoes down, while you motherfuckers bounce to this Rolling down the street, smoking indo, sipping on gin and juice Laid back with my mind on my money and my money on my mind Now, that I got me some Seagram's gin Everybody got they cups, but they ain't chipped in Now this type of shit, happens all the time You got to get yours but fool I gotta get mine Everything is fine when you listening to the D-O-G I got the cultivating music that be captivating he Who listens to the words that I speak As I take me a drink to the middle of the street And get to macking to this bitch named Sadie Sadie? She used to be the homeboy's lady Oh, that bitch Eighty degrees, when I tell that bitch please Raise up off these N-U-Ts, 'cause you gets none of these At ease, as I mob with the Dogg Pound, feel the breeze Bitch, I'm just Rolling down the street, smoking indo, sipping on gin and juice Laid back with my mind on my money and my money on my mind Later on that day My homie Dr. Dre came through with a gang of Tanqueray And a fat ass J, of some bubonic chronic that made me choke Shit, this ain't no joke I had to back up off of it and sit my cup down Tanqueray and chronic, yeah I'm fucked up now But it ain't no stopping, I'm still popping Dre got some bitches from the city of Compton To serve me, not with a cherry on top 'Cause when I bust my nut, I'm raising up off the cot Don't get upset girl, that's just how it goes I don't love you hoes, I'm out the door And I'll be Rolling down the street, smoking indo, sipping on gin and juice Laid back with my mind on my money and my money on my mind Rolling down the street, smoking indo, sipping on gin and juice, bitch With my mind on my money and my money on my mind Rolling down the street, smoking indo, sipping on gin and juice, bitch With my mind on my money and my money on my mind"
a lot,21 Savage,Other,"I love you Turn my headphone down a little bit, yeah For so many reasons Yeah, yeah, yeah, yeah, yeah, yeah (I do) Yeah, yeah yeah yeah Yeah, yeah, ah, ah, whoa, whoa, whoa, yeah How much money you got? (Straight up) How much money you got? (Straight up) How much money you got? (Straight up) How much money you got? (A lot) How much money you got? (A lot) How many problems you got? (A lot) How many people done doubted you? (A lot) Left you out to rot? (A lot) How many pray that you flop? (A lot) How many lawyers you got? (A lot) How many times you got shot? (A lot) How many niggas you shot? (A lot) How many times did you ride? (A lot) How many niggas done died? (A lot) How many times did you cheat? (A lot) How many times did you lie? (A lot) How many times did she leave? (A lot) How many times did she cry? (A lot) How many chances she done gave you? Fuck around with these thots (A lot) Every day that I'm alive, I'ma ride with the stick I'd rather be broke in jail than be dead and rich Told my brothers take my breath if I turn to a snitch But I'm 21 4L, ain't no way I'ma switch Break it down, I break it down I break it down, I break it down I break it down, I break it down I break it down, I break it down Penitentiary chances just to make a couple bucks My heart so cold I could put it in my cup Gang vs. the world, me and my dawg, it was us Then you went and wrote a statement And that really fucked me up My brother lost his life and it turned me to a beast My brother got life and it turned me to the streets I been through the storm and it turned me to a G But the other side was sunny, I get paid to rap on beats How much money you got? (A lot) How many problems you got? (A lot) How many people done doubted you? (A lot) Left you out to rot? (A lot) How many pray that you flop? (A lot) How many lawyers you got? (A lot) How many times you got shot? (A lot) How many niggas you shot? (A lot) How many times did you ride? (A lot) How many niggas done died? (A lot) How many times did you cheat? (A lot) How many times did you lie? (A lot) How many times did she leave? (A lot) How many times did she cry? (A lot) How many chances she done gave you? Fuck around with these thots (A lot) Break it on down, I break it on down I break it on down, I break it on down Yeah, I just came from the A I drove back home, six hour drive, six and a half Before I left I stopped by to See my nigga 21 in the studio Yeah, two of his kids with him Right in the studio, that's when I knew You a stand up nigga, I love seein' shit like that Question How many faking they streams? (A lot) Getting they plays from machines (A lot) I can see behind the smoke and mirrors Niggas ain't really big as they seem (Hmm) I never say anything (Nah) Everybody got they thing (True) Some niggas make millions Other niggas make memes (Hmm) I'm on a money routine I don't want smoke, I want cream I don't want no more comparisons This is a marathon and I'm aware I been playing it back from a lack of promotions I was never one for the bragging and boasting I guess I was hoping the music would speak For itself, but the people want everything else Ok, no problem, I'll show up on everyone album You know what the outcome will be I'm batting a thousand It's got to the point that these Rappers don't even like rappin' with me Fuck it 'cause my nigga 21 Savage just hit me And told me he sent me a spot on a new record he got He call it ""a lot, "" I open my book and I jot Pray for Tekashi, they want him to rot I picture him inside a cell on a cot 'Flectin' on how he made it to the top Wondering if it was worth it or not I pray for Markelle 'cause they fucked up his shot Just want you to know that you got it, my nigga Though I never met you, I know that you special And that the Lord blessed you, don't doubt it, my nigga Dennis Smith Jr., stay solid, my nigga I'm on a tangent, not how I planned it I had some fans that hopped and abandoned ship When they thought that I wasn't gone pan out, I got a plan They say that success is The greatest revenge, tell all your friends Cole on a mission Cementin' the spot as the greatest who did it Before it all ends, nigga How much money you got? (A lot) How many problems you got? (A lot) How many people done doubted you? (A lot) Left you out to rot? (A lot) How many pray that you flop? (A lot) How many lawyers you got? (A lot) How many times you got shot? (A lot) How many niggas you shot? (A lot) How many times did you ride? (A lot) How many niggas done died? (A lot) How many times did you cheat? (A lot) How many times did you lie? (A lot) How many times did she leave? (A lot) How many times did she cry? (A lot) How many chances she done gave you? Fuck around with these thots (A lot) Break it on down, I break it on down I break it on down, I break it on down I break it down, I break it down I break it down, I break it down I break it on down, I break it down I break it down, I break it down I break it down, I break it down I break it down, I break it down, I br-"
